{
  "schema_version": "2.0",
  "generated_at": "2026-09-15T03:53:34Z",
  "based_on_trends": {"file": "tendances/2026/2026-W38.json", "period": {"start": "2026-08-18", "end": "2026-09-14"}},
  "opportunities": [
    {
      "id": "opp-2026-W38-01", "canonical_id": "haies-dossiers-regime-unique", "first_seen": "2026-W37", "last_seen": "2026-W38",
      "previous_period_id": "opp-2026-W37-01", "previous_confidence": 5, "confidence_delta": 0,
      "evolution_note": "L'échéance du 1er octobre rapproche le besoin de l'achat opérationnel. La confiance reste maximale ; la question est désormais la part réellement externalisée aux BE.",
      "title": "Haies : diagnostic et montage des dossiers du régime unique",
      "hypothesis": "À compter du 1er octobre 2026, les porteurs de projets détruisant des haies devront sécuriser une déclaration ou autorisation unique, avec cartographie, compensation et pièces complémentaires lorsque des enjeux espèces protégées, Natura 2000, paysage ou patrimoine sont présents.",
      "central_question_answer": "Produire des dossiers haies réglementaires standardisés et géoréférencés, incluant diagnostic écologique, linéaire compensatoire et articulation espèces protégées/Natura 2000.",
      "need_type": ["prestation", "expertise", "donnee", "outil_methodologique"],
      "buyer_personas": ["exploitant agricole", "aménageur", "collectivité", "DDT(M)"],
      "jobs_to_be_done": ["Qualifier le régime applicable", "Cartographier haies et enjeux", "Dimensionner la compensation", "Assembler les pièces de déclaration ou d'autorisation"],
      "linked_trends": ["2026-W38-haies-regime-unique"], "confidence": 5,
      "risks_and_unknowns": ["Part des dossiers simples traitée en interne", "Doctrine préfectorale territoriale encore hétérogène", "Volume de prestations après le 1er octobre non mesuré"],
      "validation_questions": ["Le décret impose-t-il des pièces externalisables ?", "Des achats de montage de dossier apparaissent-ils ?", "Les cas complexes nécessitent-ils un diagnostic écologique externe ?"]
    },
    {
      "id": "opp-2026-W38-02", "canonical_id": "restauration-nature-diagnostics-plans", "first_seen": "2026-W36", "last_seen": "2026-W38",
      "previous_period_id": "opp-2026-W37-02", "previous_confidence": 5, "confidence_delta": 0,
      "evolution_note": "La nécessité technique reste élevée, mais le plan national n'est toujours pas stabilisé. Les mesures espèces et démonstrateurs renforcent les compétences nécessaires sans créer encore une vague visible de marchés NRP.",
      "title": "Restauration de la nature : diagnostics, objectifs territoriaux et suivi des restaurations",
      "hypothesis": "La mise en œuvre du règlement européen et du futur plan national obligera État, collectivités et gestionnaires à hiérarchiser des habitats à restaurer, définir des objectifs mesurables et suivre l'efficacité écologique.",
      "central_question_answer": "Passer d'inventaires descriptifs à des diagnostics de restauration : état initial, potentiel, objectifs quantifiés, programme de mesures, cartographie et indicateurs de suivi.",
      "need_type": ["prestation", "expertise", "donnee", "outil_methodologique"],
      "buyer_personas": ["DREAL/OFB", "collectivité/EPCI", "gestionnaire Natura 2000", "gestionnaire d'espace naturel"],
      "jobs_to_be_done": ["Cartographier les milieux dégradés", "Prioriser les mesures", "Construire un plan de restauration", "Mettre en place les indicateurs de suivi"],
      "linked_trends": ["2026-W38-restauration-nature-operationnelle"], "confidence": 5,
      "risks_and_unknowns": ["Plan national encore en élaboration", "Budgets territorialisés non stabilisés", "Internalisation possible par OFB/DREAL"],
      "validation_questions": ["Le plan national a-t-il été transmis ou publié ?", "Des marchés citent-ils explicitement le NRP ?", "Les financements couvrent-ils diagnostic et suivi ?"]
    },
    {
      "id": "opp-2026-W38-03", "canonical_id": "eau-rdd-zh-adaptation", "first_seen": "2026-W36", "last_seen": "2026-W38",
      "previous_period_id": "opp-2026-W37-03", "previous_confidence": 5, "confidence_delta": 0,
      "evolution_note": "Le marché de mesure des reliquats est documenté par un marché public et la tension hydrologique reste forte. Confiance maximale maintenue.",
      "title": "Eau : mesures de reliquats, diagnostics zones humides et programmation d'adaptation hydrique",
      "hypothesis": "L'expérimentation bretonne sur les reliquats, le nouveau cadre zones humides et le stress hydrologique durable augmentent la demande de mesures, diagnostics réglementaires et programmation d'actions eau.",
      "central_question_answer": "Mesurer et interpréter les reliquats d'azote, sécuriser les dossiers zones humides/IOTA et transformer les données hydrologiques en programmes d'actions et de suivi.",
      "need_type": ["prestation", "donnee", "expertise", "outil_methodologique"],
      "buyer_personas": ["DRAAF/Chambre d'agriculture", "syndicat d'eau/SAGE", "collectivité", "exploitant agricole", "DDT(M)"],
      "jobs_to_be_done": ["Organiser les campagnes RDD", "Interpréter les résultats", "Mettre à jour diagnostics zones humides/IOTA", "Construire un programme d'adaptation hydrique"],
      "linked_trends": ["2026-W38-eau-stress-investissements"], "confidence": 5,
      "risks_and_unknowns": ["Segment RDD dominé par laboratoires/agronomie", "Doctrine zones humides encore en consolidation", "Financement variable selon territoires"],
      "validation_questions": ["Les campagnes RDD sont-elles externalisées ?", "Les syndicats achètent-ils l'ingénierie d'adaptation ?", "Le cadre zones humides génère-t-il de nouveaux cahiers des charges ?"]
    },
    {
      "id": "opp-2026-W38-04", "canonical_id": "pfas-autosurveillance-boues", "first_seen": "2026-W36", "last_seen": "2026-W38",
      "previous_period_id": "opp-2026-W37-04", "previous_confidence": 5, "confidence_delta": 0,
      "evolution_note": "La redevance et l'autosurveillance sont complétées par des marchés dédiés aux PFAS dans les boues de STEP. Le besoin est directement acheté.",
      "title": "PFAS : plan d'autosurveillance, campagnes eaux/boues et stratégie de filière",
      "hypothesis": "Les collectivités et exploitants doivent organiser des campagnes PFAS, fiabiliser l'assiette de redevance, qualifier les boues et décider des filières d'élimination ou de traitement.",
      "central_question_answer": "Concevoir et piloter une chaîne complète PFAS : inventaire des flux, plan de prélèvement, analyses, interprétation réglementaire, priorisation des sources et stratégie boues/rejets.",
      "need_type": ["prestation", "expertise", "donnee", "outil_methodologique"],
      "buyer_personas": ["STEU/syndicat d'eau", "collectivité/EPCI", "exploitant ICPE", "agence de l'eau"],
      "jobs_to_be_done": ["Définir le plan d'échantillonnage", "Piloter laboratoire et QA/QC", "Interpréter redevance/autosurveillance", "Qualifier boues et scénarios de gestion"],
      "linked_trends": ["2026-W38-pfas-boues-autosurveillance"], "confidence": 5,
      "risks_and_unknowns": ["Concurrence laboratoires/traitement", "Cadre boues encore évolutif", "Ne pas confondre ingénierie et vente de procédé"],
      "validation_questions": ["Des AO ciblent-ils explicitement eaux ou boues PFAS ?", "L'autosurveillance déclenche-t-elle des prestations ?", "L'ingénierie est-elle achetée séparément du laboratoire ?"]
    },
    {
      "id": "opp-2026-W38-05", "canonical_id": "adaptation-post-extremes-programmation", "first_seen": "2026-W36", "last_seen": "2026-W38",
      "previous_period_id": "opp-2026-W37-05", "previous_confidence": 4, "confidence_delta": 0,
      "evolution_note": "Les besoins et financements restent manifestes, mais les contraintes budgétaires locales augmentent. Pas de signal suffisant pour passer à 5.",
      "title": "Adaptation post-extrêmes : diagnostic de vulnérabilité et programmation d'investissements",
      "hypothesis": "Après l'été 2026, les collectivités devront prioriser des programmes concrets de prévention, renaturation, eau, feu de forêt et confort d'été avec des enveloppes limitées.",
      "central_question_answer": "Hiérarchiser les vulnérabilités et transformer un diagnostic climat/risques en portefeuille de mesures techniquement justifiées et finançables.",
      "need_type": ["prestation", "expertise", "outil_methodologique"],
      "buyer_personas": ["collectivité/EPCI", "syndicat d'eau", "gestionnaire forestier", "services de l'État"],
      "jobs_to_be_done": ["Construire un diagnostic multi-risques", "Prioriser sites et mesures", "Définir le programme d'investissement", "Préparer les éléments techniques de financement"],
      "linked_trends": ["2026-W38-extremes-adaptation-budgets"], "confidence": 4,
      "risks_and_unknowns": ["Budgets collectivités sous tension", "Marché partagé avec cabinets climat/finance", "Risque d'offre trop générique"],
      "validation_questions": ["Les financements couvrent-ils l'ingénierie amont ?", "Des marchés ciblent-ils la programmation post-extrêmes ?", "Quels risques déclenchent réellement un achat BE ?"]
    },
    {
      "id": "opp-2026-W38-06", "canonical_id": "enr-electrification-etudes-environnement", "first_seen": "2026-W36", "last_seen": "2026-W38",
      "previous_period_id": "opp-2026-W37-06", "previous_confidence": 4, "confidence_delta": 1,
      "evolution_note": "Les 109 territoires d'électrification et plusieurs marchés récents rendent le besoin plus concret. Confiance 4 → 5.",
      "title": "Électrification/EnR : pré-cadrage environnemental et dossiers de projets territoriaux",
      "hypothesis": "La multiplication des projets d'électrification, réseaux, ombrières et EnR augmente les besoins de pré-cadrage intégrant biodiversité, eau, paysage, foncier et autorisations.",